### ISSUE TITLE
Randomly pad server salt payload to increase fingerprinting resistance

### ISSUE THREAD

**Issue by gh-andre** [Jigsaw-Code/outline-apps#2561]
### Application

Outline Client

### Describe the bug

I'm seeing these errors in Outline Client on Android when trying to connect from a mobile network. The same client on the same device connects successfully on a landline or over a WiFi connection.

> Cause: ERR_PROXY_SERVER_READ_FAILURE: failed to read HTTP HEAD response from the server Cause: ERR_INTERNAL_ERROR: failed to read salt: read tcp 1.2.3.4:5678->4.3.2.1:8765: i/o timeout

I'm not experienced in AEAD, so this may be completely wrong, but from my TCP experience, it would seem to me that ISPs may detect the 32-byte TCP payload (server salt) following the SYN/ACK exchange on registered or dynamic ports (i.e. 1K-60K) and can drop those packets, which would stop most Outline connection attempts without a significant effort from adversarial ISPs.

Can the server not accompany its salt with some encrypted length+random-padding to avoid sending this easily detectable 32-byte server salt payload?

Having said that, I cannot run a network monitor on Android, so my conclusions are just from my online research in trying to figure out why am I seeing these salt timeouts, and may be incorrect.

### Steps to reproduce

This error depends on the ISP and cannot be reproduced at will. What I'm seeing is this, however:

* On a landline, using an Android device (latest .apk)
* connecting to an Outline server works fine

* On a mobile network, same Android device
* connecting to an Outline server results in the salt read timeout

### What did you expect to happen?

Outline traffic is not easily fingerprintable from its connection sequence.

### What actually happened?

The client times out reading the salt from the server, which likely happens because ISPs drop easily detectable server salt packets.

### Outline Version

1.12.3

### What operation system are you using?

Android

**Comment by nikitalvovich** [comment]
I have the same on ios client

**Comment by sh-nick** [comment]
Same problem on wired internet provider (on PC with full wired connection and on laptop with WiFi connection to router). The problem arose a few days ago. But sometimes I can connect to Ouline Server.
Operating System: Windows 10 (ver. 21H2)
Ouline Client ver: 1.15.1

**Comment by daniellacosse** [comment]
@fortuna I don't have immediate detailed knowledge of Shadowsocks' connection process - I'm surprised to hear it requires any predictably-sized payload. Is this true, and can we do as @gh-andre suggests?

**Comment by fortuna** [comment]
Our shadowsocks implementation doesn't send the salt until the first application data is sent, merging them and making the packet length hard to predict. If you see that not being the case, that's a regression, so please file a detailed issue with packet captures that show the packet sizes.

See https://github.com/Jigsaw-Code/outline-server/blob/master/docs/shadowsocks.md for more.

**Comment by gh-andre** [comment]
@fortuna Not sure why you closed this. Whether this is actually taking place or not, this error is real and many people are experiencing this issue.

I was really hoping that the Outline team would be able to provide some additional help in troubleshooting this issue, given that it's not just an individual case. From my side, I while I cannot run a network monitor on an Android, but I will try doing so on Windows and see if I capture anything. 

Regardless of the above, I must say this is a real issue and I'm hoping you would reconsider closing this issue without any follow-ups. I will also note that AEAD does not have provisions against censorship, and only focuses on security, so it would have to be something Outline has to implement on top of AEAD. If it does, great - I stand corrected, but the error is still happening.

**Comment by daniellacosse** [comment]
@fortuna multiple people have logged this issue this week - I can change the title to reflect that we're unsure what the problem is and must investigate it.

**Comment by gh-andre** [comment]
Thank you, gentlemen. It is much appreciated. I will try to see if I can get anything useful from Wireshark on Windows in the next couple of days. 

I also don't think it's mobile-only issue - it's just how it's happening in my case, but it would just be a matter of which ISP has the equipment to detect these cases and drop server responses.

**Comment by daniellacosse** [comment]
I'm finally getting around to going through the issue backlog and I've seen about four issues total, one of which was in Russian. I would start there: The major mobile internet service providers in Russia include MTS, MegaFon, Beeline, Tele2, and Yota, according to Google.

You can use SOAX to tunnel into the country and poke around: https://soax.com/

I wonder if a certain prefix would work - https://developers.google.com/outline/docs/guides/service-providers/prefixing

**Comment by fortuna** [comment]
@gh-andre, I'm sorry, the closing was not intentional. I got confused with the issue on my phone. I thought this one was asking to implement something we already have (make packet size not fixed). The error is valid.

You can try different clouds, port, [prefix disguises](https://developers.google.com/outline/docs/guides/service-providers/prefixing) or [Websocket](https://developers.google.com/outline/docs/guides/service-providers/websockets).

**Comment by gh-andre** [comment]
@fortuna @daniellacosse  Thank you very much, guys. Outline is a lifesaver.

When I initially read about prefixes, I thought I had to configure the server to make it understand prefixes, but reading the linked docs, it appears that it just usurps part of the salt and no server configuration change is required. Is this interpretation correct and all I need is to add `&prefix=...` to the `ss://...` URI to make it work?

If so, I will give it a try, but it may take some time. I'm also a bit worried about decreasing entropy of the salt, as well as introducing a fixed sequence that is described publicly into the protocol, so adversarial ISPs can focus on signatures mentioned on that page describing prefixes to get started, as it would be fairly simple to identify that the rest of the frame has nothing to do with the prefix.

**Comment by daniellacosse** [comment]
I understand your concern, but if ISPs were to block certain prefixes (like "POST "), likely they'd drop most HTTP traffic.

**Comment by gh-andre** [comment]
I cannot speak for the kind of equipment ISPs have access to, but even Wireshark would identify things like mismatching checksums, etc., so a deep packet inspection app would probably be able to identify that `POST ` is followed by some non-HTTP random data in the same TCP packet and flag it as a disguise of something they should block, so real protocols would get through. Same for other prefixes - TLS handshake is fairly complicated and contains a lot of bits that the prefix wouldn't have, so any syntax-aware DPI would flag it.

**Comment by daniellacosse** [comment]
Yeah, it really depends on what equipment they have. Let us know what you find out!

**Comment by nikitalvovich** [comment]
We  are in Russia. I have around 25.000 active users. 

And I get around ~100 reports daily about this issue. 

We use prefixes already + we use tunneling. Does not seem to help. 

I am not a technical guy, but i have developers working for me. If there is anything I can do, to fix this ASAP, please tell me. And I will refer it to my developers

**Comment by nikitalvovich** [comment]
I also tried other outline server providers and got the same error. 

I think this issue is SUPER URGENT for Russia.

**Comment by fortuna** [comment]
For Websocket, this tutorial may be easier to deploy, as it doesn't use Cloudflare: https://codepoetry.ru/post/nastraivaiem/

**Comment by gh-andre** [comment]
I tried this with a Windows client on Windows 11 and I'm seeing those salt read errors quite often. Given that in the case I described in the original issue connections fail every time on a mobile network, we might be looking at 2 different issues here.

Here's, what I observed on Windows. Some CONNECT attempts are successful and some come back with the salt read errors. Here's what I'm seeing in Wireshark. First, a failed connection.

Notice in frame 11, the client sends 151 bytes of data and never receives the server response, but there's an ACK for those 151 bytes. There is no server `FIN` either, so the client sits there and keeps sending keep-alives. This shouldn't be the case of a dropped packet because when the connection is established, not a single packet is being dropped and retransmitted, which Wireshark usually highlights and I'm not seeing any of those.
```
No.     Time           Source                Destination           Protocol Length Info
      6 4.479249       192.168.1.124         12.34.56.78         TCP      66     58764 → 12345 [SYN] Seq=0 Win=65535 Len=0 MSS=1460 WS=256 SACK_PERM
      7 4.479641       192.168.1.124         12.34.56.78         UDP      118    65402 → 12345 Len=76
      8 4.598719       12.34.56.78         192.168.1.124         UDP      191    12345 → 65402 Len=149
      9 4.603716       12.34.56.78         192.168.1.124         TCP      66     12345 → 58764 [SYN, ACK] Seq=0 Ack=1 Win=62727 Len=0 MSS=1452 SACK_PERM WS=128
     10 4.603968       192.168.1.124         12.34.56.78         TCP      54     58764 → 12345 [ACK] Seq=1 Ack=1 Win=65280 Len=0

     11 4.605232       192.168.1.124         12.34.56.78         TCP      205    58764 → 12345 [PSH, ACK] Seq=1 Ack=1 Win=65280 Len=151

     12 4.728190       12.34.56.78         192.168.1.124         TCP      60     12345 → 58764 [ACK] Seq=1 Ack=152 Win=62592 Len=0
     24 14.478289      192.168.1.124         12.34.56.78         TCP      54     58764 → 12345 [FIN, ACK] Seq=152 Ack=1 Win=65280 Len=0
     31 14.641848      12.34.56.78         192.168.1.124         TCP      60     12345 → 58764 [ACK] Seq=1 Ack=153 Win=62592 Len=0

     48 30.077222      12.34.56.78         192.168.1.124         TCP      60     [TCP Keep-Alive] 12345 → 58764 [ACK] Seq=0 Ack=153 Win=62592 Len=0
     49 30.077288      192.168.1.124         12.34.56.78         TCP      54     [TCP Keep-Alive ACK] 58764 → 12345 [ACK] Seq=153 Ack=1 Win=65280 Len=0
     56 45.435281      12.34.56.78         192.168.1.124         TCP      60     [TCP Keep-Alive] 12345 → 58764 [ACK] Seq=0 Ack=153 Win=62592 Len=0
```

Here's a successful connection attempt, with some subsequent data. The actual session was longer and had no errors in it. Notice in frame 12, the server responds with 306 bytes of data and an ACK for the client's 151 bytes. Every successful attempt has one of those. I also see UDP packets arrive in different timing, but I don't know if there's any meaning in that.
```
No.     Time           Source                Destination         Protocol Length Info
      5 2.433864       192.168.1.124         12.34.56.78         TCP      66     56207 → 12345 [SYN] Seq=0 Win=65535 Len=0 MSS=1460 WS=256 SACK_PERM
      6 2.433953       192.168.1.124         12.34.56.78         UDP      118    61766 → 12345 Len=76
      7 2.543188       12.34.56.78         192.168.1.124         TCP      66     12345 → 56207 [SYN, ACK] Seq=0 Ack=1 Win=62727 Len=0 MSS=1452 SACK_PERM WS=128
      8 2.543451       192.168.1.124         12.34.56.78         TCP      54     56207 → 12345 [ACK] Seq=1 Ack=1 Win=65280 Len=0

      9 2.544788       192.168.1.124         12.34.56.78         TCP      205    56207 → 12345 [PSH, ACK] Seq=1 Ack=1 Win=65280 Len=151
     10 2.561402       12.34.56.78         192.168.1.124         UDP      191    12345 → 61766 Len=149
     11 2.654180       12.34.56.78         192.168.1.124         TCP      60     12345 → 56207 [ACK] Seq=1 Ack=152 Win=62592 Len=0
     12 2.953803       12.34.56.78         192.168.1.124         TCP      360    12345 → 56207 [PSH, ACK] Seq=1 Ack=152 Win=62592 Len=306
     13 2.954132       192.168.1.124         12.34.56.78         TCP      54     56207 → 12345 [FIN, ACK] Seq=152 Ack=307 Win=65024 Len=0
     14 3.104019       12.34.56.78         192.168.1.124         TCP      60     12345 → 56207 [ACK] Seq=307 Ack=153 Win=62592 Len=0
     15 3.213547       12.34.56.78         192.168.1.124         TCP      60     12345 → 56207 [FIN, ACK] Seq=307 Ack=153 Win=62592 Len=0
     16 3.213622       192.168.1.124         12.34.56.78         TCP      54     56207 → 12345 [ACK] Seq=153 Ack=308 Win=65024 Len=0

     18 6.400947       192.168.1.124         12.34.56.78         UDP      133    61645 → 12345 Len=91
     19 6.521850       12.34.56.78         192.168.1.124         UDP      214    12345 → 61645 Len=172
     20 6.603048       192.168.1.124         12.34.56.78         UDP      138    57328 → 12345 Len=96
     21 6.719091       12.34.56.78         192.168.1.124         UDP      282    12345 → 57328 Len=240

     22 6.724712       192.168.1.124         12.34.56.78         TCP      66     56209 → 12345 [SYN] Seq=0 Win=65535 Len=0 MSS=1460 WS=256 SACK_PERM
     23 6.836096       12.34.56.78         192.168.1.124         TCP      66     12345 → 56209 [SYN, ACK] Seq=0 Ack=1 Win=62727 Len=0 MSS=1452 SACK_PERM WS=128
     24 6.836457       192.168.1.124         12.34.56.78         TCP      54     56209 → 12345 [ACK] Seq=1 Ack=1 Win=65280 Len=0

     25 6.854783       192.168.1.124         12.34.56.78         TCP      281    56209 → 12345 [PSH, ACK] Seq=1 Ack=1 Win=65280 Len=227
     27 6.945473       192.168.1.124         12.34.56.78         UDP      147    61645 → 12345 Len=105
     28 6.963288       12.34.56.78         192.168.1.124         TCP      60     12345 → 56209 [ACK] Seq=1 Ack=228 Win=62592 Len=0
     29 6.969566       12.34.56.78         192.168.1.124         TCP      307    12345 → 56209 [PSH, ACK] Seq=1 Ack=228 Win=62592 Len=253
     30 6.970182       12.34.56.78         192.168.1.124         TCP      60     12345 → 56209 [FIN, ACK] Seq=254 Ack=228 Win=62592 Len=0
     31 6.970277       192.168.1.124         12.34.56.78         TCP      54     56209 → 12345 [ACK] Seq=228 Ack=255 Win=65280 Len=0
     32 6.971079       192.168.1.124         12.34.56.78         TCP      54     56209 → 12345 [FIN, ACK] Seq=228 Ack=255 Win=65280 Len=0
     33 7.060014       12.34.56.78         192.168.1.124         UDP      234    12345 → 61645 Len=192
     34 7.080455       12.34.56.78         192.168.1.124         TCP      60     12345 → 56209 [ACK] Seq=255 Ack=229 Win=62592 Len=0

     35 7.096870       192.168.1.124         12.34.56.78         UDP      133    57328 → 12345 Len=91
     36 7.097657       192.168.1.124         12.34.56.78         UDP      133    61645 → 12345 Len=91
     37 7.211190       12.34.56.78         192.168.1.124         UDP      214    12345 → 57328 Len=172
     38 7.218686       12.34.56.78         192.168.1.124         UDP      214    12345 → 61645 Len=172
```

I observed a bad connection in my testing about every 2-3 successful connections. I will also add that the Outline Server is quite far away geographically, but I'm on a fast connection, so I don't see many delays in the network traces. There is a bunch of backbone routers on the way, though.

I also wanted to reiterate my original point. Every time the client connects, it always sends the packet of 151 bytes. I tried a bunch of times and all connect attempts have the same length. This would allow ISPs that enforce censorship to use it as a red flag. It really should use some encrypted random padding when connecting for the first time. Subsequent connection attempts seem to use data, so they are different, but the very first one can be detected.

**Comment by alexander-potemkin** [comment]
Getting the same - regardless of the network and location: so **that is not due to DPI / blocks / censorship**!

It is pure software issue, started to occurs like for the last few days.

**Comment by nikitalvovich** [comment]
This is URGENT. 

Outline is almost unusable. Creators of Outline, please pay maximum attention to this problem

**Comment by alexander-potemkin** [comment]
Last iOS release has been at 'May 14, 2025', the server wasn't updated for a while as well (mine has been working for 2 months).

So from a pure developer perspective - is shall not be an issue with software. But, I'm getting the same error - not constantly, but often enough (like once per 3-4 connections attempt and _only when the connection was not open for some time_), being in a location without any censorship / traffic intervention, so it doesn't seem to be an issue with censorship as well.

The issue persists on both iOS and Linux, so it's most probably not related to anything platform specific.

@fortuna , I understand that what I'm saying probably won't help much, but it looks like it's some hell of the issue that might be extremely complicated to troubleshoot.
The only clue I've managed to notice so far - is that the issue reproduces when the connection was not open for quite some time (like 8 hours) on that device.
I understand it doesn't give much, I will keep an eye on that with a hope to figure out more.

**Comment by Vladimir6202** [comment]
I have the same problem. I own a vpn service with 10k users in Russia. 

Everyday I get hundreds of reports. 

I beg you, please fix this problem!

**Comment by daniellacosse** [comment]
> Getting the same - regardless of the network and location: so **that is not due to DPI / blocks / censorship**!
> 
> It is pure software issue, started to occurs like for the last few days.

Many were reporting this only happing on mobile - you're seeing it on local/wifi networks as well?

**Comment by gh-andre** [comment]
@daniellacosse 
> Many were reporting this only happing on mobile - you're seeing it on local/wifi networks as well?

The network traces I posted were captured on a good landline connection, so I think there are 2 issues here. One is the Outline server not responding to a connection attempt (even though the ACK arrives just fine) and another one is with mobile networks, which may as well be DPI blocking traffic because Outline's initial connect sequence is the same for all initial connections and prefixes bolted on top of the salt won't be much help against any good DPI app.

**Comment by Eitiidisuda** [comment]
Exactly the same error. The computer and smartphone are in the same wifi network, the same key is used, but it works on the PC, but does not work on smartphones (ios and android)

**Comment by alexander-potemkin** [comment]
> > Getting the same - regardless of the network and location: so **that is not due to DPI / blocks / censorship**!
> > It is pure software issue, started to occurs like for the last few days.
> 
> Many were reporting this only happing on mobile - you're seeing it on local/wifi networks as well?

It's that mobile's network DPI are much more... sophisticated: things that doesn't work on mobile more often than not works on landline / wifi networks.

In my case (outside of any DPIs) the issue happens on both local / wifi and mobile networks, which are two different network operators altogether - this and variety of OSes impacted  (iOS & Linux) + the fact that the error appears after some time and  connection works on a second attempt make me think that something is wrong on some library level.

As a weird guess, something related to the way the time is handled or the way the time affects encryption functions (since the issue appears on the SW which didn't change for quite some time - it must be something in it).

Happy to carry on some debug version or something, if that could only help!

**Comment by jyyi1** [comment]
Thank you all for contributing to this issue.

As @alexander-potemkin [mentioned](https://github.com/Jigsaw-Code/outline-apps/issues/2561#issuecomment-3101441121), we haven't released new versions of the Outline Client or Server for >2 months. If you've only recently started experiencing these issues, it suggests that the problem is not due to critical implementation defects within the software.

Given the randomness of the errors (occurring periodically across different networks, and devices); and the common location reported (which seems to be Russia; please add your location if you're experiencing this elsewhere), _**we suspect it might be related to [recent Internet throttling by the Russian government](https://blog.cloudflare.com/russian-internet-users-are-unable-to-access-the-open-internet/)**_. (Throttling doesn't necessarily mean a complete block; rather, packets can be dropped at a random rate.)

@gh-andre , thank you for [the detailed Wireshark logs](https://github.com/Jigsaw-Code/outline-apps/issues/2561#issuecomment-3100498606). They indicate _**the client never received the initial packet (with the actual payload) from the server**_. This could be due to the server response being randomly dropped (as mentioned, possibly due to throttling).

As we are unable to reproduce this issue on our end, we'd greatly appreciate any help from server providers. If you have access to your Outline server, please share any abnormal logs (e.g., errors, warnings). _**A Wireshark traffic capture from the server would be incredibly useful to confirm whether the server has sent out the initial packet**_. This will also help us rule out any implementation defects in the server. 

For now, this issue remains quite mysterious to us and requires significant effort to investigate. We're hopeful that with your continued help, we can get to the bottom of this.

**Comment by alexander-potemkin** [comment]
@jyyi1 , like I've mentioned - I'm not in Russia and from what I'm aware of, EU has no DPI and blocks of any kind.
Since I'm getting the very same error, I do believe it is something related to the underlying libraries.

**Comment by gh-andre** [comment]
@jyyi1 Thanks for responding.

> This could be due to the server response being randomly dropped (as mentioned, possibly due to throttling).

I don't think the server packet was dropped in transit because you can see how in the working workflow the server combined ACK and the server data in one packet. In the failed workflow, the client receives the same ACK just as fast as in the first case, but there is no server response. I think this strongly suggests that it's not a networking issue, but the server not responding at the application level.

I will also add that even though I'm geographically away from the server and there's a bunch of routers in between, there should be no censorship anywhere on the path from my client to the server in this specific test.

> A Wireshark traffic capture from the server would be incredibly useful to confirm whether the server has sent out the initial packet.

I thought about this, but it will take me time to set it up. I will see if I can do it this weekend. Will post here once I get something usable.

Also, those fixed packet sizes in the first client/server interaction can most definitely be used by DPI apps to detect Outline connections. I would advise to create another issue for that - sounds like it would be an independent change, which perhaps will take some effort and time.

**Comment by jyyi1** [comment]
Thanks @alexander-potemkin and @gh-andre , given your suspect on the network code problem, let me offer a bit more insight into the underlying library we're using.

- Connection writer (shared by both client and server): https://github.com/Jigsaw-Code/outline-sdk/blob/2d0cb830a5e025f7d65eb936daf745ddd7749dea/transport/shadowsocks/stream.go#L35-L258
- Server's entry point for TCP: https://github.com/Jigsaw-Code/outline-ss-server/blob/5522935db32278fee07145693ddf021c10e76fcc/cmd/outline-ss-server/main.go#L267-L281
- Server handles initial packets of TCP connection: https://github.com/Jigsaw-Code/outline-ss-server/blob/5522935db32278fee07145693ddf021c10e76fcc/service/tcp.go#L324

**Comment by gh-andre** [comment]
@jyyi1 Is there anything on the server I can look at, like logs or Prometheus stats? With the latter, if you can point me to the JSON syntax, it would help - I don't use the manager and maintain the server via API requests. With logs, if you can point me to the relevant log files, it would be helpful as well, as I'm not familiar whether those are in the container, mapped within the OS, etc. Thanks.

**Comment by alexander-potemkin** [comment]
> Thanks [@alexander-potemkin](https://github.com/alexander-potemkin) and [@gh-andre](https://github.com/gh-andre) , given your suspect on the network code problem, let me offer a bit more insight into the underlying library we're using.
>  <...>

Thank you. I was hoping to get some support from the authors of the code - from my experience, getting into any more or less complicated project requires at least a few days of full time job, given that you are proficient with frameworks and tooling (and I'm not a Go person).

It is clearly that the issue is far from being obvious and I doubt that any newbie in the project, like I am, would be able to figure out anything of use by just looking at the snippets of code.

What usually works - it's a debug build / extended logs, that would show more details - at which step this specific issue happens. If not - than an strace, as a last resort. But `strace-ing` GUI app - is a kind of hell, and command line doesn't support ssconf yet (yes, I know - I can write a parser and make it work, but it would be a different code from the client, wouldn't it?).

Hope that makes sense, but as well happy to stand corrected, if I'm missing something.

**Comment by gh-andre** [comment]
I had some time to run `tcpdump` on the server and it shows the same pattern - Outline server never responds to the client's connection attempt.

Here's client traffic. Note that the packet with 151 bytes is sent and an ACK for it is received, but the server's 306 bytes response never arrives. The client waits for 10 seconds and then sends a FIN.
```
No.     Time           Source                Destination           Protocol Length Info
      7 3.825399       192.168.1.124         12.34.56.78         TCP      66     64716 → 12345 [SYN] Seq=0 Win=65535 Len=0 MSS=1460 WS=256 SACK_PERM
      8 3.825576       192.168.1.124         12.34.56.78         UDP      118    54905 → 12345 Len=76
      9 3.941610       12.34.56.78         192.168.1.124         UDP      191    12345 → 54905 Len=149
     10 3.950861       12.34.56.78         192.168.1.124         TCP      66     12345 → 64716 [SYN, ACK] Seq=0 Ack=1 Win=62727 Len=0 MSS=1452 SACK_PERM WS=128
     11 3.950977       192.168.1.124         12.34.56.78         TCP      54     64716 → 12345 [ACK] Seq=1 Ack=1 Win=65280 Len=0

     12 3.951378       192.168.1.124         12.34.56.78         TCP      205    64716 → 12345 [PSH, ACK] Seq=1 Ack=1 Win=65280 Len=151

     13 4.060518       12.34.56.78         192.168.1.124         TCP      60     12345 → 64716 [ACK] Seq=1 Ack=152 Win=62592 Len=0
     31 13.833776      192.168.1.124         12.34.56.78         TCP      54     64716 → 12345 [FIN, ACK] Seq=152 Ack=1 Win=65280 Len=0
     32 13.984844      12.34.56.78         192.168.1.124         TCP      60     12345 → 64716 [ACK] Seq=1 Ack=153 Win=62592 Len=0
```

Here's the server side. It does receive 151 bytes from the client, sends an ACK for it and nothing else. The server receives a FIN from the client in 10 seconds.
```
No.     Time           Source                Destination           Protocol Length Info
      1 0.000000       78.56.34.12         10.1.2.3           UDP      124    54905 → 12345 Len=76
      2 0.000155       78.56.34.12         10.1.2.3           TCP      72     64716 → 12345 [SYN] Seq=0 Win=65535 Len=0 MSS=1434 WS=256 SACK_PERM
      3 0.000197       10.1.2.3           78.56.34.12         TCP      72     12345 → 64716 [SYN, ACK] Seq=0 Ack=1 Win=62727 Len=0 MSS=8961 SACK_PERM WS=128
      4 0.004948       10.1.2.3           78.56.34.12         UDP      197    12345 → 54905 Len=149
      5 0.124932       78.56.34.12         10.1.2.3           TCP      66     64716 → 12345 [ACK] Seq=1 Ack=1 Win=65280 Len=0

      6 0.124932       78.56.34.12         10.1.2.3           TCP      211    64716 → 12345 [PSH, ACK] Seq=1 Ack=1 Win=65280 Len=151

      7 0.125001       10.1.2.3           78.56.34.12         TCP      60     12345 → 64716 [ACK] Seq=1 Ack=152 Win=62592 Len=0
      8 10.008336      78.56.34.12         10.1.2.3           TCP      66     64716 → 12345 [FIN, ACK] Seq=152 Ack=1 Win=65280 Len=0
      9 10.049324      10.1.2.3           78.56.34.12         TCP      60     12345 → 64716 [ACK] Seq=1 Ack=153 Win=62592 Len=0
```

Looking at Prometheus reports for closed connections, as shown below, I see `ERR_RELAY_CLIENT` for my ASN, which tells me that the server is actively failing this connection for some reason.
```
curl 'http://localhost:9090/api/v1/query?query=increase(shadowsocks_tcp_connections_closed%5B1d%5D)' | jq -M
```
I don't see any way to look at the logs. I tried `docker logs shadowbox`, but it doesn't have anything useful. If there's anything else, let me know how to look at it.

**Comment by goroption** [comment]
i have 2 strange news
First of all - 

1. i use linux desktop client,
2. im not in russia, 
3. and im using my home wifi 

today im also have same problem with connection through outline. 

But, what is really strange, i just go away for 15 minutes, come back to my laptop and try again to connect - and it works...
im literally do nothing, and problem is gone

**Comment by alexander-potemkin** [comment]
> i have 2 strange news First of all -
> 
> 1. i use linux desktop client,
> 2. im not in russia,
> 3. and im using my home wifi
> 
> today im also have same problem with connection through outline.
> 
> But, what is really strange, i just go away for 15 minutes, come back to my laptop and try again to connect - and it works... im literally do nothing, and problem is gone

Yep, the issue usually occurs after some significant pause (looks like 3+ hours) and if you retry to connect a few times - it connects

**Comment by mnosov622** [comment]
It's better now, previously connected only after 2nd or 3rd attempt, not sure what happened. Still happens sometimes same issue on Wifi, mobile network, but now it's rare, looks like a provider is blocking ?

**Comment by alexander-potemkin** [comment]
> It's better now, previously connected only after 2nd or 3rd attempt, not sure what happened. Still happens sometimes same issue on Wifi, mobile network, but now it's rare, looks like a provider is blocking ?

Inernational ISPs coordinated block of HTTS like traffic across the globe looks less probable for me as opposed to some - very tricky - but still software issue.

**Comment by laowant** [comment]
This issue is definitely not caused by blocking from the Russian or Chinese governments. I have nodes in Japan, Singapore, Taiwan, and the United States. I also tested Outline on remote Windows servers located in Japan, Singapore, Taiwan, and the U.S., and encountered the exact same problem.

Whenever the issue occurs, it affects all countries simultaneously. When there's no issue, all regions work without problems.

Also, when I use Shadowrocket to connect to these nodes, everything works fine — because Shadowrocket does not check for a successful connection after establishing the link.

Can you release a new version of Outline that removes the connection-checking code?

**Comment by mnosov622** [comment]
That's an interesting point! When I use other apps, it also works, but suddenly for Outline it doesn't connect sometimes.

It's also interesting that when I connect to a new server, it works fine, but the previous one doesn't work sometimes and that's why I think it's getting blocked or something.

**Comment by alexander-potemkin** [comment]
> Can you release a new version of Outline that removes the connection-checking code?

That a great finding!

I wonder why that code stopped working in the first place. You can always remove checks, but if they fail, that usually means something is going wrong and it's worth finding the root cause for that.

**Comment by fortuna** [comment]
It sounds like one theory is that the connectivity check is taking too long, so the client assumes failure and doesn't start the session. If the check succeeds, it's then fine.

We need two changes:
- Increate the [test TCP timeout](https://github.com/Jigsaw-Code/outline-apps/blob/7eea5e4956eeeb34e8c79f91d4058cd841595075/client/go/outline/connectivity/connectivity.go#L29) from 10x to perhaps 30s.
- [Change the connectivity test to not depend on `example.com`](https://github.com/Jigsaw-Code/outline-apps/issues/2326). My guess is that it's slow sometimes, hurting the connectivity test. 

While at it, we should probably increase the [UDP timeout](https://github.com/Jigsaw-Code/outline-apps/blob/7eea5e4956eeeb34e8c79f91d4058cd841595075/client/go/outline/connectivity/connectivity.go#L30) from 1 to 5 seconds (we try 5 times)

Here is the timeout fix: https://github.com/Jigsaw-Code/outline-apps/pull/2565
@jyyi1 please review

We still need to fix the dependency on `example.com`.

**Comment by alexander-potemkin** [comment]
> It sounds like one theory is that the connectivity check is taking too long, so the client assumes failure and doesn't start the session. If the check succeeds, it's then fine.

But it was working fine before?
It isn’t that all of the devices became slower all of the sudden?

**Comment by fortuna** [comment]
@alexander-potemkin perhaps `example.com` became slower/is overloaded.

**Comment by alexander-potemkin** [comment]
> [@alexander-potemkin](https://github.com/alexander-potemkin) perhaps `example.com` became slower/is overloaded.

Thanks, that makes sense. Why not replace it with `http://cp.cloudflare.com/generate_204` for example?

**Comment by gh-andre** [comment]
@fortuna 
> It sounds like one theory is that the connectivity check is taking too long

I don't think it's the timeout issue. From my traces it's clear that the server isn't sending a response for 10 seconds, after which the client assumes the failure and misreports it as a bad salt read. My server is underloaded, so there is no way the Outline server takes 10 seconds to respond.

The more likely cause of this is the server failing silently on something, like verifying the client response, such as in that `h.authenticate` call (not suggesting it is, but it's as if that call fails).

The other thing worth looking into is that the server generates `ERR_RELAY_CLIENT` within Prometheus, so there's got to be some failure point that can be traced in what generates this error on a failed client connection.

**Comment by jyyi1** [comment]
Thanks @fortuna for the fix! Approved.

@gh-andre , it seems there might be a misunderstanding about the overloaded server. Here's a breakdown of what's happening:

1. The client tests the server's connectivity first by [asking Outline server to fetch "example.com"](https://github.com/Jigsaw-Code/outline-apps/blob/master/client/go/outline/connectivity/connectivity.go#L55).

2. The server tries to fulfill this, but **"example.com" is likely overloaded** or unstable, causing a delay or no responses.

3. Because Outline server doesn't respond within 10 seconds, the client assumes our server isn't responding, closes the connection, and triggers the "i/o timeout" error.

Regarding `ERR_RELAY_CLIENT`, could you please provide more information about the [underlying error](https://github.com/Jigsaw-Code/outline-ss-server/blob/5522935db32278fee07145693ddf021c10e76fcc/service/tcp.go#L316) in Prometheus? If the underlying error is `ErrClosed`, it would confirm the client has timed out and closed the connection, as described in step 3.

**Comment by gh-andre** [comment]
@jyyi1 
> Regarding ERR_RELAY_CLIENT, could you please provide more information about the [underlying error](https://github.com/Jigsaw-Code/outline-ss-server/blob/5522935db32278fee07145693ddf021c10e76fcc/service/tcp.go#L316) in Prometheus? If the underlying error is ErrClosed, it would confirm the client has timed out and closed the connection, as described in step 3.

I got the error from Prometheus as described via `curl`. This error code is all that it provides in that output, besides ASN and time stamp. I verified that the time stamp corresponds to the time of my failed connection attempt, but I don't see any other way to obtain more info. Like I mentioned before, if you provide some way to obtain more information on the server, I can have a look, but I exhausted my exploratory capabilities to find any meaningful logged error on my own.

> The client tests the server's connectivity first by [asking Outline server to fetch "example.com"](https://github.com/Jigsaw-Code/outline-apps/blob/master/client/go/outline/connectivity/connectivity.go#L55).

Outline client/server connectivity is intermittent - I get about one bad attempt for every 2-3 good attempts on a good network. I supposed it could be hitting one of their blocking deployments. 

That is, `dig example.com.` comes back with these:
```
example.com.            99      IN      A       23.192.228.80
example.com.            99      IN      A       23.192.228.84
example.com.            99      IN      A       23.215.0.136
example.com.            99      IN      A       23.215.0.138
example.com.            99      IN      A       96.7.128.175
example.com.            99      IN      A       96.7.128.198
```
Those in the `23.*` range respond right away, but those in the `96.*` range block indefinitely. So, if this test request is in the call chain of the initial connection negotiation, it could indeed be hitting those blocking IP addresses.

**Comment by gh-andre** [comment]
If this indeed turns out to be the culprit, it might be a good idea to rename this issue to reflect the intermittent Outline connectivity rather than an issue with mobile networks. I think the latter might be caused by the fixed-size initial handshake exchange between the Outline client and server, which makes it trivial to be spotted by DPI devices.

**Comment by fortuna** [comment]
@gh-andre Thanks for the investigation. The IPs finding confirms the hypothesis. I can't fetch `http://96.7.128.198` even with curl! 

```
$ curl http://96.7.128.198
curl: (28) Failed to connect to 96.7.128.198 port 80 after 75003 ms: Couldn't connect to server
```

So the IP you hit is dictating whether the connection succeeds.

Changing the timeout is not enough. We will have to change the connectivity test logic.

_(And you are right, the metrics don't give more info than the error code)_

**Comment by fortuna** [comment]
Fix to make the connectivity test more robust: https://github.com/Jigsaw-Code/outline-apps/pull/2566

**Comment by laowant** [comment]
Is it possible to disable connection probing?

**Comment by mnosov622** [comment]
Wow! This is amazing :)

**Comment by alexander-potemkin** [comment]
> hahaha.I have completely resolved this issue. On the server, I hijacked requests to example.com and redirected them to my own forged example.com. For HEAD requests, it returns a 200 status.

I would guess that redirect it to CloudFlare or Google for 204 code (link above) would be an even better thing to do. That is what lots of other VPN solutions do.

**Comment by kostmines** [comment]
Same issue. Server works fine, but outline doesn't connect on ios/mac os/windows machines. Ping goes well, but no connection via client.

**Comment by Antoxa113** [comment]
After updating the OS on the server from 20 to 22, the error disappeared. Both from the RF and outside the RF.

**Comment by nikitalvovich** [comment]
> After updating the OS on the server from 20 to 22, the error disappeared. Both from the RF and outside the RF.

Could someone please tell me, do I need to update it myself, or it will happen by itself? 

If I need to do it, please tell me, what should I put into terminal 🙏

**Comment by gh-andre** [comment]
Should self-update when the fix is released. Keep an eye on this page:

https://github.com/Jigsaw-Code/outline-server/releases

You can check the current version of the server with this:
```
sudo docker inspect --format='{{index .Config.Labels "shadowbox.github.release"}}' shadowbox
```

**Comment by Svisha** [comment]
The same problem as everyone else, I am in China, where everything worked very well until July 21, but now it does not work, I found a temporary solution, use other clients to connect Outline, everything works great. I hope you will fix this problem soon.

I have many users, the problem occurs for many, now I have transferred most of them to another client for connection, the problem disappeared with the other client.

**Comment by qehmu** [comment]
Hello guys. I cant take off limit from a key. How to do it?
Im tried with API key, but idk, does it need the https://ip and port?  Not sure at this point, if I am exactly at the server?
'curl --insecure -X DELETE https://ip-port/API-key/name of my server/Key that i want to take off limit.
{"code":"ResourceNotFound","message":"/API-key/name of my server/Key... does not exist"}% 
What I am doing wrong?
Thanks for answer.

**Comment by gh-andre** [comment]
@qehmu Ask your question here:

https://github.com/Jigsaw-Code/outline-apps/discussions

**Comment by romeozzzzz** [comment]
> The same problem as everyone else, I am in China, where everything worked very well until July 21, but now it does not work, I found a temporary solution, use other clients to connect Outline, everything works great. I hope you will fix this problem soon.
> 
> I have many users, the problem occurs for many, now I have transferred most of them to another client for connection, the problem disappeared with the other client.

Which clients did you use? As temp working solution. Still Waiting to fix this bug on genuine OUTLINE

**Comment by nikitalvovich** [comment]
It has been 9 day since this critical error has been described. 

Why releasing a fix is taking so long?

**Comment by YogeneP** [comment]
Hello everyone,
Here are my packets tracing logs, maybe it may help as well:
Client Packet Log 
#	Time (s)	Direction	Protocol	Info
1	0.000000	CLIENT_IP → SERVER_IP	TCP	SYN, SrcPort=58585 → DstPort=27476, Seq=0 Len=0
2	0.000231	CLIENT_IP → SERVER_IP	UDP	SrcPort=53228 → DstPort=27476, Len=76
3	0.062907	SERVER_IP → CLIENT_IP	TCP	SYN-ACK, SrcPort=27476 → DstPort=58585, Ack=1
4	0.063118	CLIENT_IP → SERVER_IP	TCP	ACK, SrcPort=58585 → DstPort=27476, Seq=1 Ack=1
5	0.063982	CLIENT_IP → SERVER_IP	TCP	PSH-ACK, SrcPort=58585 → DstPort=27476, Seq=1 Ack=1, Len=151
6	0.360826	CLIENT_IP → SERVER_IP	TCP	Retransmission, PSH-ACK, Seq=1 Ack=1, Len=151
7	0.662041	CLIENT_IP → SERVER_IP	TCP	Retransmission, PSH-ACK, Seq=1 Ack=1, Len=151
8	1.000811	CLIENT_IP → SERVER_IP	UDP	SrcPort=53228 → DstPort=27476, Len=76
9	1.083598	SERVER_IP → CLIENT_IP	UDP	SrcPort=27476 → DstPort=53228, Len=149 (response)
10	1.276517	CLIENT_IP → SERVER_IP	TCP	Retransmission, PSH-ACK, Seq=1 Ack=1, Len=151
11	2.483420	CLIENT_IP → SERVER_IP	TCP	Retransmission, PSH-ACK, Seq=1 Ack=1, Len=151
12	4.885055	CLIENT_IP → SERVER_IP	TCP	Retransmission, PSH-ACK, Seq=1 Ack=1, Len=151
13	9.693553	CLIENT_IP → SERVER_IP	TCP	Retransmission, PSH-ACK, Seq=1 Ack=1, Len=151
14	9.999208	CLIENT_IP → SERVER_IP	TCP	FIN-ACK, Seq=152 Ack=1
15	19.307245	CLIENT_IP → SERVER_IP	TCP	RST-ACK, Seq=153 Ack=1

Server Packet Log 
#	Time (s)	Direction	Protocol	Info
1	0.000000	CLIENT_IP → SERVER_IP	TCP	SYN, SrcPort=58585 → DstPort=27476, Seq=4052621246
2	0.000056	SERVER_IP → CLIENT_IP	TCP	SYN-ACK, SrcPort=27476 → DstPort=58585, Seq=1748274998 Ack=4052621247
3	0.015095	CLIENT_IP → SERVER_IP	UDP	SrcPort=53228 → DstPort=27476, Len=76
4	0.017187	SERVER_IP → CLIENT_IP	UDP	SrcPort=27476 → DstPort=53228, Len=149
5	0.069972	CLIENT_IP → SERVER_IP	TCP	ACK, SrcPort=58585 → DstPort=27476, Ack=1, Win=255
6	1.017124	CLIENT_IP → SERVER_IP	UDP	SrcPort=53228 → DstPort=27476, Len=76
7	1.018778	SERVER_IP → CLIENT_IP	UDP	SrcPort=27476 → DstPort=53228, Len=149
8	15.334916	SERVER_IP → CLIENT_IP	TCP	ACK, SrcPort=27476 → DstPort=58585, Ack=1, Win=490
9	30.654937	SERVER_IP → CLIENT_IP	TCP	ACK, SrcPort=27476 → DstPort=58585, Ack=1, Win=490
10	46.014915	SERVER_IP → CLIENT_IP	TCP	ACK, SrcPort=27476 → DstPort=58585, Ack=1, Win=490
11	59.035498	SERVER_IP → CLIENT_IP	TCP	FIN-ACK, SrcPort=27476 → DstPort=58585, Seq=1 Ack=1, Win=490
12	59.310936	SERVER_IP → CLIENT_IP	TCP	FIN-ACK (retransmission), Seq=1 Ack=1, Win=490
13	59.582920	SERVER_IP → CLIENT_IP	TCP	FIN-ACK (retransmission), Seq=1 Ack=1, Win=490
14	60.158911	SERVER_IP → CLIENT_IP	TCP	FIN-ACK (retransmission), Seq=1 Ack=1, Win=490
15	61.247936	SERVER_IP → CLIENT_IP	TCP	FIN-ACK (retransmission), Seq=1 Ack=1, Win=490
16	63.423951	SERVER_IP → CLIENT_IP	TCP	FIN-ACK (retransmission), Seq=1 Ack=1, Win=490
17	68.031926	SERVER_IP → CLIENT_IP	TCP	FIN-ACK (retransmission), Seq=1 Ack=1, Win=490
18	76.735925	SERVER_IP → CLIENT_IP	TCP	FIN-ACK (retransmission), Seq=1 Ack=1, Win=490
19	94.143941	SERVER_IP → CLIENT_IP	TCP	FIN-ACK (retransmission), Seq=1 Ack=1, Win=490
20	131.931939	SERVER_IP → CLIENT_IP	TCP	FIN-ACK (retransmission), Seq=1 Ack=1, Win=490

The packet 0.063982	CLIENT_IP → SERVER_IP	TCP	PSH-ACK, SrcPort=58585 → DstPort=27476, Seq=1 Ack=1, Len=151 never reaches the server and it is being retransmitted several times. After that the client terminates the connection, but the server doesn't receive this event too.

**Comment by alexander-potemkin** [comment]
> It has been 9 day since this critical error has been described.
> 
> Why releasing a fix is taking so long?

Nikita, please, correct me if I'm wrong, but the connection happens - just not after the first attempt: the client might need to retry two of three times max.

If that is correct - the issue is not critical: it has a work-around. Don't think it's error either - the issue happens due to the reliance on a third party service, that has been working reliably for quite some time.

So, to rephrase your statement: you might be wondering why the developers are not rushing to make a release on a significant issue. If so - I would expect them to take some time to ensure the release won't screw up things.

And, as always, it's an open source free software: "why are you not giving me what I want when I want" - is not exactly the most motivational way of dealing with people providing it to you.

**Comment by Svisha** [comment]
> > The same problem as everyone else, I am in China, where everything worked very well until July 21, but now it does not work, I found a temporary solution, use other clients to connect Outline, everything works great. I hope you will fix this problem soon.
> > I have many users, the problem occurs for many, now I have transferred most of them to another client for connection, the problem disappeared with the other client.
> 
> Which clients did you use? As temp working solution. Still Waiting to fix this bug on genuine OUTLINE

try searching on the internet

**Comment by pilot639** [comment]
We also have a connection problem. The connection is intermittent.

**Comment by gh-andre** [comment]
@nikitalvovich Also, just to be clear, this fix seems to be shaping up as a client-only fix, so you would just need to grab the new `.apk` file if this continues to be the case. 

Hopefully, somebody from the Outline team will clarify this in this thread when it's all said and done.

**Comment by gh-andre** [comment]
@YogeneP There is some network problem in your case, unlike with my trace, which just shows the server being blocked on `example.com`. In your trace the client doesn't even receive server's `ACK`'s, even though the server does send them. Looks like your ISP is applying some filtering.

Was this captured on a mobile network? Are you using any custom prefixes in your client configuration?

**Comment by jyyi1** [comment]
> It has been 9 day since this critical error has been described.
> 
> Why releasing a fix is taking so long?

We hear you on the urgency of the fix and are aiming to release the fix this week or early next week.

The new release is more than just this bug fix; it also includes a major Android API and `cordova-android` upgrade (which caused app crashes during our internal QA), plus a new dark theme (also introduced some usability issues during QA).

Because of these significant changes, we need to thoroughly QA the release to prevent any new critical issues. We appreciate your patience while we ensure a stable release.

Also, feel free to build the app yourself; all our code is open source.

**Comment by nikitalvovich** [comment]
> > It has been 9 day since this critical error has been described.
> > 
> > Why releasing a fix is taking so long?
> 
> We hear you on the urgency of the fix and are aiming to release the fix this week or early next week.
> 
> The new release is more than just this bug fix; it also includes a major Android API and `cordova-android` upgrade (which caused app crashes during our internal QA), plus a new dark theme (also introduced some usability issues during QA).
> 
> Because of these significant changes, we need to thoroughly QA the release to prevent any new critical issues. We appreciate your patience while we ensure a stable release.
> 
> Also, feel free to build the app yourself; all our code is open source.

Thank you for the code. I actually have my own apps on AppStore and on Google play. 

Fix through client side is bad for me, because apple won't let me update my app :(

**Comment by nikitalvovich** [comment]
> > It has been 9 day since this critical error has been described.
> > 
> > Why releasing a fix is taking so long?
> 
> Nikita, please, correct me if I'm wrong, but the connection happens - just not after the first attempt: the client might need to retry two of three times max.
> 
> If that is correct - the issue is not critical: it has a work-around. Don't think it's error either - the issue happens due to the reliance on a third party service, that has been working reliably for quite some time.
> 
> So, to rephrase your statement: you might be wondering why the developers are not rushing to make a release on a significant issue. If so - I would expect them to take some time to ensure the release won't screw up things.
> 
> And, as always, it's an open source free software: "why are you not giving me what I want when I want" - is not exactly the most motivational way of dealing with people providing it to you.

You are absolutely right about open source. Did not mean to upset anyone. 

Just got worried that a fix is being pushed as something that can be done later. 

I am very grateful for the work on Outline, don't get me wrong. Just want to explain myself. 

But I live in a country where:
1) you have to switch on and off vpn ~10-15 times a day 

2) Average vpn user does not have basic knowledge on how to use a smartphone. 

Average user sees this bug and considers an app (or his/hers phone) as broken. For them it is very critical. 
And not everyone knows about this work-around. 

This fix would be worth it as standalone. 
And if it was made server-side - that would be absolute gold.

**Comment by alexander-potemkin** [comment]
@nikitalvovich 

> I actually have my own apps on AppStore and on Google play.

What is the purpose of, if I may ask?
Outline seems to be quite enduring in the app stores (guess, thanks to google behind it).
Why bothering to do your own builds?

> because apple won't let me update my app :(

Why not? VPN apps are not prohibited, from what I’m aware of…

**Comment by khantzawhein** [comment]
Hi, I just read this discussion and I want to add a useful tip to the server owners facing timeout errors. As an issue owner of #2326 , I have faced this issue long ago with Outline. 

** Nowadays, I fixed this problem by overwriting the DNS request of example.com from the server-side using dnsmasq to 1.1.1.1 or to a reliable IP. ** 

In your server, `nslookup example.com` should returns 1.1.1.1 or your own reliable IP instead of example.com’s IPs. 

So that connectivity checks to example.com would not direct to unreliable servers of example.com and redirects to somewhere more faster and reliable Cloudflare’s IP. 

I hope that might be useful for workaround the issue before Outline can produce a new update and users can also update to latest version.

**Comment by ivland** [comment]
[khantzawhein](https://github.com/khantzawhein), How exactly to do this?

**Comment by khantzawhein** [comment]
@ivland, see this repo for my implementation. 

https://github.com/khantzawhein/outline-server-dnsmasq-setup

**Comment by nikitalvovich** [comment]
> @nikitalvovich 
> 
> > I actually have my own apps on AppStore and on Google play.
> 
> What is the purpose of, if I may ask?
> Outline seems to be quite enduring in the app stores (guess, thanks to google behind it).
> Why bothering to do your own builds?
> 
> > because apple won't let me update my app :(
> 
> Why not? VPN apps are not prohibited, from what I’m aware of…

As I mentioned before I have 25.000 users. And several thousand servers. 

Own app helps: give support to people and rent servers through in-app purchase. 

Around winter 2024 apple started restricting uploading of new vpn apps. They claim it is because there are way too many similar apps. 
I needed a new app because my previous one got banned in Russia by RKN. 

A week ago they started to give me a hard time when I am trying to update  :(

**Comment by Schartoym** [comment]
I had the same problem. My Outline server is 3.5 years old and is hosted on DigitalOcean in AMS3. I tried intercepting requests to example.com and using different prefixes for connections, but nothing worked - it seems the issue is specifically with DigitalOcean blocks. I set up Outline on a new server with another provider in Kazakhstan, and everything started working fine.

**Comment by Svisha** [comment]
> [@ivland](https://github.com/ivland), см. этот репозиторий для ознакомления с моей реализацией.
> 
> https://github.com/khantzawhein/outline-server-dnsmasq-setup


thank you very much, this fixed the connection problem

**Comment by slava-smirnov** [comment]
having the same issue recently like a week or something. aws lightsail, ubuntu 22.04.1 LTS, ping ok, both iOS and macOS clients. both wifi (wired to ISP) and mobile. traceroute ok for what's it’s worth.

upd. outline manager can't connect to the server as well

**Comment by mnosov622** [comment]
> [@ivland](https://github.com/ivland), see this repo for my implementation.
> 
> https://github.com/khantzawhein/outline-server-dnsmasq-setup

Is this something to run on the server to fix the connection issue ?

**Comment by ivland** [comment]
@mnosov622, yes

**Comment by mnosov622** [comment]
> [@mnosov622](https://github.com/mnosov622), yes

Interesting, thank you so much, will try that. Does it modify outline server files to change some logic there ?

**Comment by mnosov622** [comment]
Is it safe to run this after setsing up outline server ?

**Comment by gh-andre** [comment]
I would advise against setting up that solution from the linked source repository. This setup will install a local DNS server - `dnsmasq`, and will replace `hosts` and `resolv.conf` files, so if you have anything in `hosts`, for example, you will lose it. `resolv.conf` may be overwritten by the OS on reboot, so this configuration may stop working without any notifications. Lastly, you are setting up a local DNS server, which will compete with Outline server for resources, and will not provide the same performance as a true DNS server. It's a workaround for specific setups, but isn't really something one would deploy widely.

**Comment by mnosov622** [comment]
I see, thank you

**Comment by khantzawhein** [comment]
> I would advise against setting up that solution from the linked source repository. This setup will install a local DNS server - `dnsmasq`, and will replace `hosts` and `resolv.conf` files, so if you have anything in `hosts`, for example, you will lose it. `resolv.conf` may be overwritten by the OS on reboot, so this configuration may stop working without any notifications. Lastly, you are setting up a local DNS server, which will compete with Outline server for resources, and will not provide the same performance as a true DNS server. It's a workaround for specific setups, but isn't really something one would deploy widely.

True, it's my personal setup, and caution should be taken as it would overwrite hosts and resolv.conf when you run the bash script. And of course, if you are not a server expert, try first on a *NEW SERVER* first. Do not just run it on your production server blindly. 

However, the local DNS server should not be a resource problem for Outline. I've analyzed and found that Outline directly queries from 1.1.1.1 (CloudFlare DNS) after the VPN is connected. The only time Outline would use the local DNS on the server is during the connectivity checks.

Be sure to set it up your own way, I'm here to just give you the basic idea on how to work around this issue before Outline authors fix the application.

**Comment by Batov** [comment]
having same issue on fresh outline server installation on wired and cellular clients
dnsmasq fixes it
thanks @khantzawhein

**Comment by romeozzzzz** [comment]
Just run fresh raw outline server on ubuntu 2204 and this did not help https://github.com/khantzawhein/outline-server-dnsmasq-setup , IOS client OUTLINE 1.15.2 under cellular network.

At the same time i have old MACOS shadowsocks client and it works fine, i use my iphone as APN with the same cell network.

Why may this happen? @khantzawhein

**Comment by khantzawhein** [comment]
> Just run fresh raw outline server on ubuntu 2204 and this did not help https://github.com/khantzawhein/outline-server-dnsmasq-setup , IOS client OUTLINE 1.15.2 under cellular network.
> 
> At the same time i have old MACOS shadowsocks client and it works fine, i use my iphone as APN with the same cell network.
> 
> Why may this happen? [@khantzawhein](https://github.com/khantzawhein)

Check if example.com is actually pointed to 1.1.1.1 by running nslookup example.com

**Comment by romeozzzzz** [comment]
> > Just run fresh raw outline server on ubuntu 2204 and this did not help https://github.com/khantzawhein/outline-server-dnsmasq-setup , IOS client OUTLINE 1.15.2 under cellular network.
> > At the same time i have old MACOS shadowsocks client and it works fine, i use my iphone as APN with the same cell network.
> > Why may this happen? [@khantzawhein](https://github.com/khantzawhein)
> 
> Check if example.com is actually pointed to 1.1.1.1 by running nslookup example.com

This is extreme quest on iphone. No root access from apple need to jailbreak first, have no time for this) macbook nslookup fine. Do you have any other practical ideas?

**Comment by khantzawhein** [comment]
> > > Just run fresh raw outline server on ubuntu 2204 and this did not help https://github.com/khantzawhein/outline-server-dnsmasq-setup , IOS client OUTLINE 1.15.2 under cellular network.
> > > At the same time i have old MACOS shadowsocks client and it works fine, i use my iphone as APN with the same cell network.
> > > Why may this happen? [@khantzawhein](https://github.com/khantzawhein)
> > 
> > 
> > Check if example.com is actually pointed to 1.1.1.1 by running nslookup example.com
> 
> This is extreme quest on iphone. No root access from apple need to jailbreak first, have no time for this) macbook nslookup fine. Do you have any other practical ideas?

I meant to run the command on the server, not on client.

**Comment by romeozzzzz** [comment]
> > > > Just run fresh raw outline server on ubuntu 2204 and this did not help https://github.com/khantzawhein/outline-server-dnsmasq-setup , IOS client OUTLINE 1.15.2 under cellular network.
> > > > At the same time i have old MACOS shadowsocks client and it works fine, i use my iphone as APN with the same cell network.
> > > > Why may this happen? [@khantzawhein](https://github.com/khantzawhein)
> > > 
> > > 
> > > Check if example.com is actually pointed to 1.1.1.1 by running nslookup example.com
> > 
> > 
> > This is extreme quest on iphone. No root access from apple need to jailbreak first, have no time for this) macbook nslookup fine. Do you have any other practical ideas?
> 
> I meant to run the command on the server, not on client.

Server is fine. Problem seems to be on client side. i'm 99% sure problem is about cell/provider provider blocking the client-server routes. 

THIS NEED TO BE FIXED GYUS from both server and client sides. Waiting for updates. 2nd week OUTLINE IOS is OFFLINE :(

P.S. My mate has OLD 2021-22 outline server and last client for IOS this works fine no issues.

**Comment by RusMermaid** [comment]
Same issue

**Comment by Eaax** [comment]
Same issue

**Comment by akutuzov** [comment]
> Check if example.com is actually pointed to 1.1.1.1 by running nslookup example.com

@khantzawhein thanks for your suggested solution. Unfortunately, it didn't help in my case.
`nslookup example.com` does now result in `1.1.1.1` on my Debian servers. But the Outline clients (in different locations) still cannot connect: they end up in a vicious loop of
```
[tun2socks] - checking connectivity ...
[tun2socks - EXIT]: Exited with code 0
reconnecting to ...
```
Any ideas?

**Comment by Eaax** [comment]
> > Check if example.com is actually pointed to 1.1.1.1 by running nslookup example.com
> 
> [@khantzawhein](https://github.com/khantzawhein) thanks for your suggested solution. Unfortunately, it didn't help in my case. `nslookup example.com` does now result in `1.1.1.1` on my Debian servers. But the Outline clients (in different locations) still cannot connect: they end up in a vicious loop of
> 
> ```
> [tun2socks] - checking connectivity ...
> [tun2socks - EXIT]: Exited with code 0
> reconnecting to ...
> ```
> 
> Any ideas?

After restarting the VM outline, it works in my case

**Comment by khantzawhein** [comment]
> > Check if example.com is actually pointed to 1.1.1.1 by running nslookup example.com
> 
> [@khantzawhein](https://github.com/khantzawhein) thanks for your suggested solution. Unfortunately, it didn't help in my case. `nslookup example.com` does now result in `1.1.1.1` on my Debian servers. But the Outline clients (in different locations) still cannot connect: they end up in a vicious loop of
> 
> ```
> [tun2socks] - checking connectivity ...
> [tun2socks - EXIT]: Exited with code 0
> reconnecting to ...
> ```
> 
> Any ideas?

Restart the Outline container or just reboot the whole VM so that the DNS cache is cleared in server side.

**Comment by gh-andre** [comment]
There are multiple possible causes for all of connectivity issues mentioned above. The two issues being discussed in this specific thread are:

* `example.com`, which is being used for testing server connectivity, may block for a long time on some IP addresses, and 
* ISPs may block Outline using various techniques, such as identifying 151-byte requests following initial `SYN`/`ACK` exchange

The Outline team is testing a fix for the first issue in the client. The second point hasn't even been discussed yet. It may or may be moved to another issue.

[khantzawhein](https://github.com/khantzawhein)'s workaround is specifically for the 1st issue. I would also note that only those who have good understanding of DNS resolution may get something out of it. You can verify whether the 1st issue affects you by running `dig example.com.` on the server VM and then run `curl` against all of the returned IP addresses. If it blocks on any of them, then you are affected by this issue in that every 3rd or so connection attempt fails.

If you don't see intermittent connection failures, then you are likely experiencing a different issue. In my case 100% of connection attempts fail on a mobile network and fail intermittently on a landline network, which indicates ISP filtering on the mobile network and the 1st issue on the landline.

**Comment by alexander-potemkin** [comment]
As a side and hopefully useful note, it might be worth to let server admin to define a target to test the connection against. That's what other solutions are doing and despite the configuration might be tricky at the beginning, it helps to avoid code deployment for a cases like that.

**Comment by gh-andre** [comment]
@alexander-potemkin It's a good idea in general, but not likely to be implemented because people being people will start using big names like `microsoft.com` because their infrastructure is considered always-on and there will be a large volume of test traffic from Outline servers, which will eventually result in some negative outcomes, including possible legal actions.

**Comment by alexander-potemkin** [comment]
> [@alexander-potemkin](https://github.com/alexander-potemkin) It's a good idea in general, but not likely to be implemented because people being people will start using big names like `microsoft.com` because their infrastructure is considered always-on and there will be a large volume of test traffic from Outline servers, which will eventually result in some negative outcomes, including possible legal actions.

@gh-andre , thanks for commenting on that!

I guess there are always benefits in being part of big company, like: Outline remains in the app stores, especially - in AppStore for iOS (where you can't do sideload) - because Apple won't, probably, mess with Google.
And some things to consider - like the one you mentioned.

Appreciate you shared a bit of the insights you have to deal with.

**Comment by YogeneP** [comment]
> [@YogeneP](https://github.com/YogeneP) There is some network problem in your case, unlike with my trace, which just shows the server being blocked on `example.com`. In your trace the client doesn't even receive server's `ACK`'s, even though the server does send them. Looks like your ISP is applying some filtering.
> 
> Was this captured on a mobile network? Are you using any custom prefixes in your client configuration?

Yes, the log represented had been captured by the connection attempt via cellular network. 
But the same behavior is observed with my home ISP, at my work office supplied by different ISP  the connection successes in a moment though.

As I get, here is the one branch of discussion is directed to produce some solution to make the identificarion of the handshake harder for ISP to prevent blocking.

**Comment by gh-andre** [comment]
@YogeneP That's the hope, in that once the issue with `example.com` is fixed, the Outline team will look at the detectable patterns in client/server communications.

In your trace, it's not just a bad connection, but clearly some packet filtering is applied. That is, the initial `SYN`/`ACK` sequence goes through, but then, when the first data packet with the length 151 bytes is sent, it never arrives to the server. The client cannot even finish the connection because it never receives the `ACK` for its `FIN`, so it sends `RST` (reset). Server's keep-alive packets sent every 15 seconds are being lost as well.

Depending on what ISPs use to detect these connections, it might be a tricky problem to solve. That is, if it's the first 151 bytes request being detected, hopefully Outline apps can use some random padding to avoid that fixed packet size. If, however, it is the initial connection sequence being sent to dynamic ports, this would be hard to address because it would require some session control on a single port, like 443, and that's major rework.

As a side note, you may want to create a new key because you don't really want to advertise your port. These are random ports, but they last a long time, so perhaps better to be cautious.

**Comment by alexander-potemkin** [comment]
@gh-andre , but if you will add randomness, it will prevent Outline’s traffic with HTTPS prefixes to look like normal HTTPS traffic, wouldn’t it?

**Comment by gh-andre** [comment]
@alexander-potemkin In what I described, random padding would not change how the protocol looks on the wire, just that the first packet is no longer 151 bytes, but otherwise nothing else changes.

The second point was about avoiding dynamic ports, which may also be used for Outline detection because most apps connect on various standard ports. This one would be quite hard to deal with because it would require some session control on a single port. Also, just to be clear, I wasn't suggesting this change - just outlining the range of complexities.

The 443 port I mentioned was just an example. You are right in that any protocol analyzer will detect that it's not TLS. Same for protocol prefixes tucked into client salt.

Having said all that, I'm sure the Outline team will have better ideas how to tackle this :)

**Comment by ProhoDimka** [comment]
same issue started 2 weeks ago.
I tried different ports and prefixes salt for this ports.
some times client after few tries successfully connected but nothing works instead.

**Comment by Infinity6542** [comment]
Some people are letting me know that some WiFi networks are affected as well, not sure if it's the same issue though. Connection succeeds after some retries.

**Comment by jyyi1** [comment]
Hi there, the fix is released. Check the release announcement: https://github.com/Jigsaw-Code/outline-apps/discussions/2574

**Comment by gh-andre** [comment]
@jyyi1 Thank you for the update and the fix. It is much appreciated. I can confirm that the intermittent connection errors on Windows are gone now and I can connect every single time. As soon as the Android is released and the alternative `.apk` link is available, I will test it on a mobile network. Given the error pattern, though, I think the issue on mobile networks is different from the one that got fixed in this thread.

I will note, however, that what used to be the 151 byte first data packet after the `SYN`/`ACK` exchange, now is 199 bytes, which is different in size, but is still the same from a connection to a connection. Just to be clear, I'm not saying this is what trips that wire, but it's one more identifiable thing DPIs can use.

**Comment by gh-andre** [comment]
My apologies for the delay with testing the fix on mobile networks. My users are not technical and it takes time to communicate how to download .apk, install it and how and what to test. I'm hoping to get some feedback in the coming days.

**Comment by gh-andre** [comment]
I gathered a bit more information, but some is still in flight. Here's what I know so far. 

One of the users I interacted with had an Android phone without Play Store, so they use GBox to run apps from Play Store. They installed Outline Client on the main phone from an `.apk` file I sent them the first time and then they're able to use the alternative link from the Outline website to download new Outline Client releases.

When they tried to connect to the mobile network, Outline Client reported a successful connection, but then any requests to websites like Instagram would hang indefinitely. This tells me that the initial packet size is not likely to be the thing that's preventing the Outline Client from being able to communicate with blocked websites, although I'm still not clear why some DPI device would allow the initial connection packets to go through, but not the subsequent communications. Perhaps they are being careful and just throttle heavily unknown IP protocols, but this is just my guessing.

What I don't know at this point is whether they used Outline Client from GBox or from the main phone for those mobile network tests. Some online discussions seem to suggest that some phones would split network traffic from GBox into separate channels, so if GBox relies on some Android components, like WebView or some networking channels, some of that may be blocked by the main phone, which would explain the timeouts within GBox.

I'm trying to chase down whether Outline Client was launched from the main phone or from GBox in those tests and also some connection parameters that would depend on this. Once I get this information, I will post more here.

**Comment by gh-andre** [comment]
Got some more information. The Outline Client is always running on the main phone (i.e. not in GBox). Apps from the main phone and from GBox are connecting via Outline Client and working properly on a WiFi network. In each case, all traffic goes through the Outline Client.

When connected on a mobile network, Outline Client says the connection is established, but the apps don't work and trying to browse to various sites like YouTube just hangs.

I did ask the person I was communicating with to make sure that Private DNS is on for all these tests, but I have no way of verifying whether there is any DNS caching occurring for commonly requested host names, which could manifest as hanging websites for spoofed domain names, if the DNS server provided by the mobile network is compromised.

So, all in all, in the interest of keeping one problem per issue, I would say that the fix implemented for this issue did eliminate the problem that reported an obscure and misleading error "failure to read salt", except that it was happening intermittently, but on any network, as discussed in this thread. So, perhaps this issue should be closed (maybe renamed as well to remove "mobile" from the title), and when myself or somebody else has more information about how exactly blocking occurs on some mobile network, another issue may be created with those specific details.

**Comment by jyyi1** [comment]
Thanks @gh-andre for the detailed follow-up and for confirming the fix. I'm glad to hear that the original issue is resolved. I'll go ahead and close this issue as you suggested. If other issues arise, feel free to track them in a new thread.

**Comment by gh-andre** [comment]
@jyyi1 Many thanks to the Outline team for the hard work on this project. It is much appreciated.

One more quick thing that you might find helpful in tracking blocking issues.

One of the users got back to me and now they can use Outline on a mobile network with apps like Instagram. There are two things that changed in their environment - this new release of Outline Client has different initial packet sizes *and* they started using Private DNS on Android. Based on this, it is inconclusive which of these measures helped, but I think this strongly suggests that there is no DPI being used in this case because it would block traffic regardless of either of those conditions.

I suppose that if at any point in the future Outline will stop working for them, it would be more clear that packet sizes are being inspected or a some DPI device was deployed. Until then, I suspect it all comes down to using DNS that is not ISP-provided in addition to using Outline.
